"","uid","descrip_block1_neg","descrip_block1_pos","descrip_block2_neg","descrip_block2_pos","descrip_block3_neg","descrip_block3_pos","scenario1_neg_classifier1_myself_score","scenario1_neg_classifier1_other.people_score","scenario1_neg_classifier1_specific.situations_score","scenario1_neg_classifier1_in.general_score","scenario1_pos_classifier1_in.general_score","scenario1_pos_classifier1_myself_score","scenario1_pos_classifier1_other.people_score","scenario1_pos_classifier1_specific.situations_score","scenario2_neg_classifier1_specific.situations_score","scenario2_neg_classifier1_other.people_score","scenario2_neg_classifier1_in.general_score","scenario2_neg_classifier1_myself_score","scenario2_pos_classifier1_myself_score","scenario2_pos_classifier1_specific.situations_score","scenario2_pos_classifier1_in.general_score","scenario2_pos_classifier1_other.people_score","scenario3_neg_classifier1_specific.situations_score","scenario3_neg_classifier1_other.people_score","scenario3_neg_classifier1_myself_score","scenario3_neg_classifier1_in.general_score","scenario3_pos_classifier1_in.general_score","scenario3_pos_classifier1_myself_score","scenario3_pos_classifier1_other.people_score","scenario3_pos_classifier1_specific.situations_score"
"1","subCALEARN_1","One off lack of effort relating to the event.","Generally good traits or characteristics that I have.","They were due to events that weren't my fault/couldn't be avoided.","Due to positive traits of mine.","Specific events that weren't my fault/were beyond my control.","Due to positive general character traits of mine.",0.180413439869881,0.092064306139946,0.0612017177045345,0.00473648495972157,0.990716814994812,0.903807044029236,0.00225884653627872,0.00127547571901232,0.984470367431641,0.915368139743805,0.229010015726089,0.0680554956197739,0.885722696781158,0.0731044188141823,0.0275363232940435,0.00236102193593979,0.99773770570755,0.565907657146454,0.0217686202377081,0.00183330418076366,0.941171944141388,0.860055267810822,0.00293826358392835,0.000764417753089219
"2","subCALEARN_2","an unusual occurrence on my part","I am good at doing things or communicating","an unusual occurrence","good at doing things ","somebody or something caused it","I am a good person ",0.891490936279297,0.00930670648813248,0.948998510837555,0.00180650479160249,0.262561798095703,0.949005484580994,0.0229350551962852,0.385344296693802,0.988914370536804,0.170639291405678,0.00119107088539749,0.0395610444247723,0.361306577920914,0.282951593399048,0.463431566953659,0.191946044564247,0.739300191402435,0.938225090503693,0.0125117199495435,0.459913939237595,0.43380481004715,0.971726775169373,0.0191838871687651,0.170638725161552
"3","subCALEARN_3","I'm feeling positive ","I'm feeling positive","I'm feeling positive","I'm feeling positive","When bad things happen its not my fault","I'm feeling positive ",0.837283849716187,0.16258592903614,0.351098746061325,0.576134324073792,0.614499628543854,0.835599839687347,0.145703181624413,0.390365302562714,0.390365302562714,0.145703181624413,0.614499628543854,0.835599839687347,0.835599839687347,0.390365302562714,0.614499628543854,0.145703181624413,0.649081766605377,0.968699932098389,0.0529087260365486,0.676001608371735,0.576134324073792,0.837283849716187,0.16258592903614,0.351098746061325
"4","subCALEARN_4","That it was a lapse in their judgement for that specific event and not a character flaw ","That is a part of their character to do well and be a good person, not a result of a specific event","Seemed to be the fault of something else, and not a character flaw","Because they are good at something and it's a part of their character","Another party at fault, not a character flaw","Down to myself being good, a part of my character",0.0544755086302757,0.367254048585892,0.982832193374634,0.000811562698800117,0.56320858001709,0.0511276237666607,0.377283453941345,0.0220158156007528,0.656148016452789,0.941324174404144,0.33314922451973,0.00582006294280291,0.133174315094948,0.161929115653038,0.0986031740903854,0.28902742266655,0.523804187774658,0.998093962669373,0.00136062223464251,0.160976886749268,0.478075742721558,0.981156885623932,0.000475014559924603,0.0978085994720459
"5","subCALEARN_5","They treat the negative event as a one-off rather than being indicative of general character/ability.","They are down to intrinsic characteristics rather than something done specifically for that scenario","negative events have a specific reason linked to the scenario described","They are due to intrinsic characteristics","These are a result of other circumstances at the time","These are the result of intrinsic characteristics",0.0643439292907715,0.130382686853409,0.911197125911713,0.00576117215678096,0.26535564661026,0.0329399816691875,0.0466037094593048,0.14460501074791,0.993252754211426,0.103920981287956,0.00859560165554285,0.0181505847722292,0.0275900401175022,0.776378929615021,0.00478138821199536,0.0124336183071136,0.989345729351044,0.487052023410797,0.00151117064524442,0.0408543348312378,0.0403230153024197,0.0135043412446976,0.00756093626841903,0.586531400680542
"6","subCALEARN_6","animals","edibles","man made","from nature","large man made structures","small natural objects",0.000154618814121932,0.00028302485588938,0.252195060253143,0.123333349823952,0.0226574745029211,0.0159750506281853,0.00138837716076523,0.0938407853245735,0.498280167579651,0.0244021341204643,0.574151635169983,0.929324805736542,0.000163437594892457,0.0302361790090799,0.0152705786749721,7.08402221789584e-05,0.149512678384781,0.0861447304487228,0.00820337887853384,0.390767335891724,0.0505354292690754,0.00189239252358675,0.000107476524135564,0.0820247083902359
"7","subCALEARN_7","they seemed to be more general statements rather than aimed at you personally","positive, trying to be uplifting, didnt want too make you feel bad","the negatives focused on someone else not myself","they were singled out to just me being the reason it was positive","blaming others rather than accepting responsibility","very self complimentary",0.00487898197025061,0.800677061080933,0.00161300785839558,0.988334774971008,0.773084163665771,0.210084721446037,0.329200834035873,0.233387783169746,0.886309087276459,0.99694961309433,0.00182898936327547,0.000874468358233571,0.992813169956207,0.973094403743744,0.000316088058752939,0.00255520408973098,0.28961643576622,0.980961978435516,0.0346108824014664,0.715817332267761,0.640064775943756,0.76864105463028,0.0828803852200508,0.194201409816742
"8","subCALEARN_8","All related to specific circumstances, not the individual. ","Related to the individual. ","Circumstances. ","Related to the individual ","Not related to the individual. ","Driven by the individual. ",0.00263670622371137,0.762881696224213,0.995267033576965,0.00566341681405902,0.00369978835806251,0.553896188735962,0.0657654255628586,0.974292933940887,0.982398629188538,0.240498647093773,0.381777286529541,0.0548152476549149,0.519671201705933,0.984451711177826,0.00183313002344221,0.0427522845566273,0.225469082593918,0.802169501781464,0.00311271962709725,0.915321290493011,0.00196947739459574,0.830043017864227,0.00140130950603634,0.257556080818176
"9","subCALEARN_9","it puts your mind in the right place to input your feelings 0n the task ","again gives you the right mind set to identify with the task in hand","It helps give you the right mindset for the study","it helps understand the task in hand","it helped me see the study in the right way to add my answers","it helped me identify the correct answers",0.24121680855751,0.0401445850729942,0.257615000009537,0.19384591281414,0.0507090166211128,0.168946623802185,0.0208672173321247,0.22506320476532,0.131246566772461,0.0275096576660872,0.0445141196250916,0.0771935731172562,0.126418620347977,0.5437912940979,0.0098418677225709,0.0244232751429081,0.279785811901093,0.0570271648466587,0.264081418514252,0.0678473114967346,0.466197460889816,0.16629421710968,0.0526164919137955,0.571087062358856
"10","subCALEARN_10","Attribute the reason to a short-term factor","Attribute the reason to a long term and personal factor","They were dismissed as not being their personal responsibility and also short term","Long lasting and personal","Not responsible for them or others responsible for them","personally responsible for them!",0.0191854778677225,0.020823560655117,0.739843904972076,0.00346554047428071,0.00321193994022906,0.294222682714462,0.000732917746063322,0.368527829647064,0.624491095542908,0.932262778282166,0.642559587955475,0.0146186333149672,0.662242233753204,0.985623419284821,0.00128723250236362,0.00103853282053024,0.887082934379578,0.96859073638916,0.0271260272711515,0.526131570339203,0.00481420429423451,0.931410670280457,0.0032299873419106,0.862087547779083
"11","subCALEARN_11","I didn't try hard enough.","I'm good at getting things done.","Excuses","Self praise","Excuses or someone else's fault","Due to me",0.90275651216507,0.0926046296954155,0.350340306758881,0.372721314430237,0.292659312486649,0.934803545475006,0.00846213102340698,0.430076122283936,0.914890289306641,0.595331311225891,0.888927757740021,0.303902834653854,0.940994739532471,0.138411656022072,0.0109398821368814,0.000464216835098341,0.671172976493835,0.990759968757629,0.00155484001152217,0.573729753494263,0.00514860823750496,0.997860193252563,0.00106896844226867,0.653668284416199
"12","subCALEARN_12","That it was due to something outside of my control","That it was something to do with me as a person","It was due to something outside of my control","It was due to me being a good person","It was due to things outside of my control","It was due to me",0.000886413617990911,0.685063183307648,0.366632372140884,0.221556887030602,0.00263119279406965,0.97155624628067,0.000267829105723649,0.690304040908813,0.187419563531876,0.886889576911926,0.0917033702135086,0.000467041274532676,0.952860057353973,0.222908154129982,0.103862956166267,0.000654981995467097,0.158425778150558,0.967107057571411,0.000757659436203539,0.184332564473152,0.00712139997631311,0.998410940170288,0.000317948317388073,0.682744681835175
"13","subCALEARN_13","BASED ON THE CURCIMSTANCES NOT MY COMPETENCE ","DIDNT TAKE ACCOUNTABILITY FOR PERSONALITY FLAWS OR SHORTCOMINGS ","IT WAS JUST THE SITUATION","AS A PERSON IM GOOD/VALUED ","MISUNDERSTANDING ","MY SKILLS/WORTH",0.0199342146515846,0.228118777275085,0.990999698638916,0.043638925999403,0.0434699505567551,0.0746659934520721,0.0659569725394249,0.291849851608276,0.993763327598572,0.00779779255390167,0.0125063452869654,0.0127394068986177,0.953357100486755,0.173585489392281,0.437557309865952,0.0121015878394246,0.133580252528191,0.272643148899078,0.0310329608619213,0.399904817342758,0.114067316055298,0.932527244091034,0.00023078998492565,0.11334190517664
"14","subCALEARN_14","Large animals","Small fruit/veg","Man made","Natural","Man made","Natural",0.00076992460526526,0.000152899723616429,0.508693993091583,0.251983046531677,0.00742453103885055,0.0386057794094086,0.000384485931135714,0.520637094974518,0.474978595972061,0.0381555408239365,0.529350876808167,0.589397668838501,0.207742840051651,0.0359081104397774,0.926508188247681,0.0107628265395761,0.474978595972061,0.0381555408239365,0.589397668838501,0.529350876808167,0.926508188247681,0.207742840051651,0.0107628265395761,0.0359081104397774
"15","subCALEARN_15","Fruit and vegetables","Animals","Manmade","Natural","Manmade","Natural",0.0187012422829866,0.000392868765629828,0.261707961559296,0.0312035866081715,0.0688452050089836,0.000235934101510793,0.00021235691383481,0.370512843132019,0.20972315967083,0.0262453742325306,0.789882063865662,0.0270487628877163,0.207742840051651,0.0359081104397774,0.926508188247681,0.0107628265395761,0.20972315967083,0.0262453742325306,0.0270487628877163,0.789882063865662,0.926508188247681,0.207742840051651,0.0107628265395761,0.0359081104397774
"16","subCALEARN_16","bigger than a shoebox","smaller than a shoebox","not natural","natural","large, not natural","small, natural",0.0415327176451683,0.0588983446359634,0.0874897763133049,0.126535147428513,0.153170540928841,0.199052274227142,0.100886814296246,0.232045754790306,0.231783106923103,0.0572127401828766,0.079889751970768,0.041510496288538,0.294838756322861,0.253985732793808,0.839060544967651,0.195419296622276,0.178096204996109,0.267189651727676,0.0278571210801601,0.675998032093048,0.839877426624298,0.334188342094421,0.0778113231062889,0.174593284726143
"17","subCALEARN_17","animals","food/flowers","man made items","natural things","large items","food",0.000154618814121932,0.00028302485588938,0.252195060253143,0.123333349823952,0.179243311285973,0.0174929052591324,0.000244935188675299,0.252001404762268,0.43143504858017,0.795639395713806,0.173153519630432,0.325150489807129,0.00398368109017611,0.0620222128927708,0.601901888847351,0.00031339842826128,0.250361293554306,0.0404606573283672,0.0264565162360668,0.32221782207489,0.262918680906296,0.0951568558812141,0.00183982704766095,0.229416087269783
"18","subCALEARN_18","They were pretty understanding and self-empathetic. ","Generally self-affirming, good self-esteem.","Due to circumstances, not personal failings.","High self-esteem, self-affirming","As before, they were mainly perceived as due to circumstance, not personal failings.","Pro-active, self-affirming. Likes to get involved in things.",0.0218060966581106,0.645342528820038,0.328490436077118,0.555156111717224,0.992592811584473,0.495175153017044,0.0931297391653061,0.00274881348013878,0.99598228931427,0.940999150276184,0.510639786720276,0.00160311965737492,0.559562206268311,0.133459627628326,0.539827585220337,0.0912545919418335,0.959604382514954,0.504667103290558,0.0124345673248172,0.3553406894207,0.910013496875763,0.811982572078705,0.218257322907448,0.32553294301033
"19","subCALEARN_19","Blaming themselves or the other person","Looking at the specific situation or innate talent","External to the individual","Innate ability
","External events","Innate ability",0.362364619970322,0.710696041584015,0.553827166557312,0.436353445053101,0.000634785799775273,0.0659808814525604,0.0317876748740673,0.989844083786011,0.891166567802429,0.96309906244278,0.452348709106445,0.135930299758911,0.0911398902535439,0.225018367171288,0.158153802156448,0.074429377913475,0.974855542182922,0.921970427036285,0.000695861817803234,0.128867566585541,0.0727909132838249,0.102770388126373,0.0268676914274693,0.156797051429749
"20","subCALEARN_20","i thought they were mainly due to my mood","i thought they were  because of the person i am","understandable","i felt like it was relateable","easily understood","they felt relatable",0.275489717721939,0.00123290996998549,0.242021381855011,0.00765170250087976,0.00831729359924793,0.945563435554504,0.0118793621659279,0.0637988671660423,0.28716167807579,0.43312469124794,0.95771998167038,0.167643874883652,0.182797253131866,0.0228710491210222,0.728722512722015,0.415325433015823,0.127073928713799,0.218899011611938,0.120739586651325,0.972256600856781,0.819501161575317,0.112757712602615,0.563903093338013,0.009296297095716
"21","subCALEARN_21","i didn't always agree with them","same as above, didn't always agree with them","they all focused on positive thinking","again they focused on the person's merit rather than others decisions","focusing on positive thinking","all relating to what the individual can do",0.329091340303421,0.84697812795639,0.285509943962097,0.240303456783295,0.701165854930878,0.0982984080910683,0.545895099639893,0.214686512947083,0.104965299367905,0.771124064922333,0.0875464081764221,0.0143598085269332,0.0928689986467361,0.412352472543716,0.461978793144226,0.226262554526329,0.060837484896183,0.0749287158250809,0.22075092792511,0.0940164476633072,0.438133656978607,0.21818833053112,0.000555363192688674,0.917726218700409
"22","subCALEARN_22","They look at the bigger picture and are less negative in their thought process. ","They were more positive. ","Gives the situation the benefit of the doubt and looks at the whole picture. Puts a more positive spin on it. ","They were upbeat and positive about themselves and put positive thoughts into practice.","Turned the negative event into a positive more beneficial statement.","ie. instead of saying it was well sign posted the person thought they are good at following directions which is a much brighter and positive way of building your self esteem. ",0.0728766769170761,0.281688153743744,0.00362237542867661,0.657317936420441,0.415199548006058,0.0333354733884335,0.551494896411896,0.452337890863419,0.075435109436512,0.29139968752861,0.847078859806061,0.229215860366821,0.0965728536248207,0.198349744081497,0.454282641410828,0.252368241548538,0.465367406606674,0.165059924125671,0.265202790498734,0.448530077934265,0.242324113845825,0.0447171628475189,0.0931273996829987,0.140771850943565
"23","subCALEARN_23","They were phrased in a way that wasn't self deprecating.","They were positive towards the individual.","They were forgiving towards the individual","They were positive towards the individual","They were forgiving towards the individual and not presumptuous ","They were favorable towards the individual",0.114507392048836,0.439014703035355,0.807921528816223,0.590279579162598,0.00556877395138144,0.249469518661499,0.00597577122971416,0.426743477582932,0.49949112534523,0.00914224144071341,0.00749181257560849,0.0963040441274643,0.268451631069183,0.360786765813828,0.00320291519165039,0.00783551670610905,0.527407765388489,0.0074137351475656,0.138386487960815,0.0120411198586226,0.00263178534805775,0.455292314291,0.00380084081552923,0.496092289686203
"24","subCALEARN_24","I thought about that scenario in particular and not in general as to why there is a negative outcome, such as i did something wrong in that situation and it is not because i am a bad person.","I thought of something i did positive related to the scenario such as i am able to complete something efficiently not because i can do everything and anything which was not specific to the scenario.","The situation is not because of me in particular but because of circumstances out of my control.","It is because i can personally do something good and that i have skills that allow me to succeed in that scenario.","This is because the situation was not easy and not because of me having bad traits.","It was something that i did well, a positive attribute of myself that made a positive difference.",0.889204740524292,0.0269386693835258,0.993130743503571,0.00161272403784096,0.107210107147694,0.369021892547607,0.00901674944907427,0.0281760189682245,0.0738129615783691,0.740820407867432,0.862353801727295,0.00287751201540232,0.973084092140198,0.925712406635284,0.00425188196823001,0.000139750089147128,0.989157199859619,0.0613240376114845,0.558044373989105,0.337108194828033,0.0787391811609268,0.970324754714966,0.000303173786960542,0.117661729454994
"25","subCALEARN_25","not being movitavated enough or believing in myself ","that im a good person in many aspects","sometimes we put oursleves down","its good to be happy during these things","sometimes in these events they make you feel down","in these times youve gotta get on with life in a more postive way",0.951734483242035,0.00584802124649286,0.860323011875153,0.60936975479126,0.667201161384583,0.925180196762085,0.0616983100771904,0.0294498968869448,0.691153168678284,0.0104049304500222,0.374194622039795,0.481239229440689,0.270438194274902,0.938993990421295,0.364049166440964,0.474711358547211,0.993686676025391,0.639492273330688,0.0795689597725868,0.0373701043426991,0.168952196836472,0.132340684533119,0.305949628353119,0.925685465335846
"26","subCALEARN_26","animals and things that are alive","fruit and vegetables and natural items from the world","Man made items and electrionics.","animals and living things also anything that is made in the world naturally.","Man made items including transport, instruments and furniture.","natural items like fruit and veg also animals.",0.000683889782521874,0.00081693910760805,0.220117211341858,0.21659542620182,0.279610365629196,0.0171299781650305,0.000728390412405133,0.0534366890788078,0.485775053501129,0.15008844435215,0.0566566623747349,0.00642733694985509,0.00149332557339221,0.0194246303290129,0.905994415283203,0.000341810839017853,0.18386510014534,0.403593301773071,0.0140110896900296,0.501740217208862,0.517742276191711,0.00158352311700583,0.00064451212529093,0.0356525629758835
"27","subCALEARN_27","It happens.","Life is unpredictable.","They seemed nothing to get upset about.","Being a nice person has its rewards.","There are some things which you cannot control.","It is good to remain positive.",0.335564106702805,0.893532812595367,0.421171993017197,0.941832363605499,0.908559083938599,0.148069277405739,0.495169192552567,0.420643836259842,0.0828195288777351,0.714265167713165,0.764640629291534,0.0205215886235237,0.172468841075897,0.304928600788116,0.494729965925217,0.282277792692184,0.978325068950653,0.533160507678986,0.113614410161972,0.345382004976273,0.850330650806427,0.258463084697723,0.328096449375153,0.277504086494446
"28","subCALEARN_28","The person was always looking for the positive reasoning","The person seemed very confident in their skills and ability as a person","The person was confident","The person thought a lot of themselves ","The person is self assured","The person is confident ",0.041631918400526,0.0584790520370007,0.224400460720062,0.368383675813675,0.464611440896988,0.251130908727646,0.0893188342452049,0.226748749613762,0.454728424549103,0.059174720197916,0.706181943416595,0.271628528833389,0.215129047632217,0.153968095779419,0.204261124134064,0.000220651912968606,0.352650761604309,0.00331539753824472,0.619647145271301,0.749773979187012,0.773341119289398,0.464043825864792,0.0327543132007122,0.393356561660767
"29","subCALEARN_29","they're just things that happen in life","because i'm good at them","bad things sometimes happen","because i'm good at them","bad things just happen","because i'm a good and kind person",0.0134204048663378,0.0977019071578979,0.00685086427256465,0.913517892360687,0.106597557663918,0.935534298419952,0.00424222182482481,0.513657689094543,0.87949150800705,0.560164630413055,0.840568900108337,0.110830031335354,0.935534298419952,0.513657689094543,0.106597557663918,0.00424222182482481,0.183438614010811,0.463424205780029,0.0889247134327888,0.853953003883362,0.256476849317551,0.900783717632294,0.0413254424929619,0.120163612067699
"30","subCALEARN_30","animals with 4 legs","food","man made objects","natural objects","a man made, useful object","natural, mainly food, but not all",0.000233048529480584,0.000162244046805426,0.0778499320149422,0.0779024586081505,0.262918680906296,0.0951568558812141,0.00183982704766095,0.229416087269783,0.410627633333206,0.311087518930435,0.463984727859497,0.242322951555252,0.00184414477553219,0.0421911403536797,0.438267290592194,0.000263601657934487,0.0991543680429459,0.000320868653943762,0.505835175514221,0.053728673607111,0.57536518573761,0.0289197433739901,0.000338081415975466,0.256060361862183
"31","subCALEARN_31","The negative event was applicable to that specific scenario and not a consequence of wider things going on with the person.","The positive event had more influence from outside factors.","It is not to be blamed on the person, they are wider influences here. ","The person can take full responsibility for the positive outcome because they did it themselves.","Someone else is to blame.","You can take full credit.",0.0439835377037525,0.00607283459976315,0.996437311172485,0.00120612350292504,0.205740407109261,0.000519483466632664,0.984535992145538,0.177801087498665,0.022028798237443,0.995543360710144,0.971233010292053,0.00654186122119427,0.569538950920105,0.488076508045197,0.531399369239807,0.000256938306847587,0.845267713069916,0.998381793498993,0.000426914280978963,0.772220015525818,0.549462378025055,0.00246810144744813,0.000767148740123957,0.396830320358276
"32","subCALEARN_32","Large animals ","Plants ","Man-made items","natural things ","human made & large ","Small & Natural",0.000623124709818512,0.000102157311630435,0.366166055202484,0.172080025076866,0.045678548514843,0.000259939959505573,5.05908246850595e-05,0.100502155721188,0.317011505365372,0.0424809120595455,0.525704324245453,0.00359203736297786,0.00394208449870348,0.0467179343104362,0.559656918048859,0.000238184875342995,0.204337015748024,0.852576911449432,0.723399043083191,0.584763824939728,0.469612509012222,0.226196929812431,0.0500699542462826,0.833373546600342
"33","subCALEARN_33","Made me feel a little bit more positive. ","It made me feel that I was on the right track.","I don't really any comment apart from the fact that it turns a negative event into positive.","I don't have any particular feeling towards that aside from the fact that it's nice to know that I have selected the right response","Same as previous explanations","Same as previous explanations",0.260925889015198,0.333467751741409,0.242612436413765,0.464862257242203,0.392468005418777,0.340961128473282,0.122024543583393,0.304229199886322,0.153667837381363,0.121366709470749,0.647396802902222,0.0482991896569729,0.240921184420586,0.0562020353972912,0.833944022655487,0.290876686573029,0.00556548405438662,0.0242641288787127,0.0145138958469033,0.985777616500854,0.985777616500854,0.0145138958469033,0.0242641288787127,0.00556548405438662
