"69","subCALEARN_69","The impression I got was the person was generally secure within themselves and ready to bounce back.","The impression I got was the person was confident within themselves.","This person attributes reasons to other people, or life getting in the way, not their own shortcomings.","The person praises themselves and is very introspective.","Blame others, not myself.","All down to the individual.",0.0622388422489166,0.0184174086898565,0.0708311349153519,0.598605453968048,0.305568367242813,0.0625656917691231,0.00131201324984431,0.18279992043972,0.726775407791138,0.996722757816315,0.775294661521912,0.0108046187087893,0.791712880134583,0.382303655147552,0.0242461394518614,0.000158357914187945,0.863376498222351,0.998320937156677,0.00349281565286219,0.938308715820312,0.00320660509169102,0.680897355079651,0.00355684035457671,0.926502346992493
"70","subCALEARN_70","animals","fruit / veg","man made, except one or two","natural, except one or two","Manmade","natural",0.000154618814121932,0.00028302485588938,0.252195060253143,0.123333349823952,0.052672553807497,0.0277903415262699,0.000991961918771267,0.643064856529236,0.405040591955185,0.368780553340912,0.149274677038193,0.139181807637215,0.0315992906689644,0.614843726158142,0.418235510587692,0.51224946975708,0.20972315967083,0.0262453742325306,0.0270487628877163,0.789882063865662,0.839060544967651,0.294838756322861,0.195419296622276,0.253985732793808
"71","subCALEARN_71","Animals","Vegetables or fruits","human made and small","natural and small
","human made and large","natural and small",0.000235934101510793,0.00021235691383481,0.370512843132019,0.0688452050089836,0.12506927549839,0.0113649554550648,0.000441294745542109,0.286806255578995,0.60704106092453,0.938249289989471,0.293342590332031,0.590775430202484,0.0781060755252838,0.910564959049225,0.217756703495979,0.053222618997097,0.233122751116753,0.787284016609192,0.509959101676941,0.722088098526001,0.417540043592453,0.141173899173737,0.0706132352352142,0.883498311042786
"72","subCALEARN_72","The individual is a positive person and understands that sometimes things happen and everything cant always go well","The individual is very self assured, they are proud when things go well and believe they have earned it","they seemed to mostly point towards external factors","the person was confident and self assured","The person took no accountability for them","The person was very confident in themselves",0.326401948928833,0.0177904274314642,0.448047876358032,0.27902740240097,0.21096171438694,0.400009363889694,0.00166206620633602,0.369758516550064,0.0322766527533531,0.98944878578186,0.0904605835676193,0.000637672084849328,0.178393140435219,0.159955605864525,0.493001490831375,0.0310323536396027,0.582272469997406,0.78853040933609,0.0228677038103342,0.583987951278687,0.499864995479584,0.456631720066071,0.000805663468781859,0.234479948878288
"73","subCALEARN_73","Animals","Food","Foods or plants that grow","Stuff you'd find in an office or house, man-made objects","Human made objects","Natural things like plants and animals",0.000235934101510793,0.00021235691383481,0.370512843132019,0.0688452050089836,0.115412682294846,0.0475290827453136,0.000293788354611024,0.121446192264557,0.0277250278741121,9.65924264164641e-05,0.144473493099213,0.00147797004319727,0.00267068413086236,0.964951932430267,0.417130351066589,0.00268439576029778,0.321294695138931,0.983477056026459,0.209188163280487,0.23615026473999,0.12955704331398,0.00022413871192839,4.70700651931111e-05,0.0277359504252672
"74","subCALEARN_74","Smaller items","Larger objects","Manmade","Natural","large manmade","small natural",0.0514041967689991,0.00940342992544174,0.639041841030121,0.322385400533676,0.361988127231598,0.00198849057778716,0.00260930275544524,0.543117582798004,0.20972315967083,0.0262453742325306,0.789882063865662,0.0270487628877163,0.207742840051651,0.0359081104397774,0.926508188247681,0.0107628265395761,0.0881460532546043,0.0192178171128035,0.0169316790997982,0.664260923862457,0.150149330496788,0.317235857248306,0.0112927472218871,0.140350580215454
"75","subCALEARN_75","land animals/mammels","fruit/food/vegetables","man made items? not to sure","natural items? not to sure","large items/things/objects","small objects/things",0.000699576456099749,0.000136190588818863,0.347668707370758,0.138425916433334,0.1120645403862,0.0375029854476452,0.000517164706252515,0.430403083562851,0.0500674359500408,0.215506494045258,0.104919277131557,0.00222917553037405,0.0040037278085947,0.0229952819645405,0.230892300605774,0.00191299035213888,0.354161232709885,0.00193999893963337,0.0114132529124618,0.33496505022049,0.0921788737177849,0.0200583767145872,0.00090218405239284,0.40358629822731
"76","subCALEARN_76","I am getting through it courageously ","It was a tough call but I decided to go for it against the odds","It was about the failure are more caused by others","It was a case of high self esteem","The person was taking too much on him/her self","Positive outcomes were attributed to circumstances",0.899220407009125,0.051413532346487,0.632484078407288,0.223551884293556,0.19737446308136,0.556714177131653,0.283705860376358,0.723546206951141,0.908789336681366,0.995014846324921,0.101560398936272,0.00282740220427513,0.27742812037468,0.679658651351929,0.054089542478323,0.00605455692857504,0.507537066936493,0.000478021946037188,0.249197244644165,0.332184940576553,0.307062059640884,0.0303216222673655,0.0388894081115723,0.968783617019653
"77","subCALEARN_77","For negative events it seemed to suggest that the reason was just a one off event.","The positive events were the opposite to negative, in that the reason was a larger more general idea rather than a one off.","Negative events are caused by external factors.","Positive events are caused by the person themselves.","Negative events are caused by external factors.","Positive events are caused by the person.",0.0871218368411064,0.113785892724991,0.938882529735565,0.00786860566586256,0.982683122158051,0.0380341187119484,0.127123773097992,0.0152156008407474,0.382999420166016,0.62475860118866,0.445911765098572,0.00254169688560069,0.861066877841949,0.444097846746445,0.132523074746132,0.000355562980985269,0.382999420166016,0.62475860118866,0.00254169688560069,0.445911765098572,0.235240712761879,0.403094947338104,0.00497688772156835,0.405614405870438
"78","subCALEARN_78","Bad things are not your fault","Positive thinking that you are a good person and good things happen for that reason","They are not your fault ","You deserve them","You do not feel worthy","You are worthy",0.0229772869497538,0.873380243778229,0.462561458349228,0.703899323940277,0.398514896631241,0.309946537017822,0.127794489264488,0.0443761721253395,0.812197864055634,0.963886678218842,0.651910066604614,0.0238966681063175,0.00221135839819908,0.441205441951752,0.393143206834793,0.0252891667187214,0.398250430822372,0.0832880735397339,0.0252656564116478,0.546726822853088,0.494968146085739,0.00281352177262306,0.0143867563456297,0.234436735510826
"79","subCALEARN_79","Animate objects","Inanimate objects","Man-made objects","Natural objects","Large man-made objects","Natural objects",0.00169271824415773,0.00180731620639563,0.0837076008319855,0.143137842416763,0.171755254268646,0.000125967882922851,4.77607609354891e-05,0.0136153921484947,0.296840459108353,0.00163732771761715,0.642913997173309,0.00174232583958656,0.000982930418103933,0.0161668807268143,0.436794072389603,7.67926903790794e-05,0.157361581921577,0.00112390040885657,0.000811622478067875,0.337999522686005,0.436794072389603,0.000982930418103933,7.67926903790794e-05,0.0161668807268143
"80","subCALEARN_80","They didn't feel too negatively about life overall because of this.","They looked more optimistically.","It's due to aspects that affect everyone, not jus the individual.","They happened due to individual characteristics, rather than looking at the bigger picture.","It was due to situations in other people's live rather than issues with the individual.","It was due to aspects that affect their overall life, such as intelligence or hard working skills.",0.0284786317497492,0.60864394903183,0.255097240209579,0.962631225585938,0.361169219017029,0.0081989374011755,0.698931217193604,0.383910417556763,0.00691273249685764,0.982585251331329,0.997080445289612,0.0089315278455615,0.0484357364475727,0.996330261230469,0.00215213885530829,0.167280897498131,0.899492979049683,0.997501373291016,0.00142262398730963,0.192993506789207,0.0321959368884563,0.0464005768299103,0.171187072992325,0.0968275740742683
"81","subCALEARN_81","Larger objects, usually animals","Smaller objects, usually fruit and veg or small insects","Human-made","Natural","large, human-made","small, natural",7.70971309975721e-05,0.000165414050570689,0.446028023958206,0.0238083582371473,0.114594832062721,0.00118361634667963,0.000175490611582063,0.49537605047226,0.260065674781799,0.975282192230225,0.272491574287415,0.729913592338562,0.207742840051651,0.0359081104397774,0.926508188247681,0.0107628265395761,0.195329040288925,0.991122126579285,0.405725747346878,0.76537811756134,0.839877426624298,0.334188342094421,0.0778113231062889,0.174593284726143
"82","subCALEARN_82","Things which are meat eaters","Things which are not meat eaters","Man made things","Natural things","Things larger than a shoe box","Things smaller than a shoe box",0.011429532431066,0.670236051082611,0.956914126873016,0.413722187280655,0.370830804109573,0.00895416177809238,0.710123002529144,0.970870435237885,0.3922298848629,0.130159974098206,0.536461532115936,0.153236702084541,0.00307775428518653,0.0136484485119581,0.723634779453278,0.000115733077109326,0.678976476192474,0.0115559073165059,0.00738687627017498,0.285523444414139,0.14964359998703,0.0258299764245749,0.00315486383624375,0.584177613258362
"83","subCALEARN_83","large items","small items","man made","natural","human made","natural",0.0264565162360668,0.0404606573283672,0.250361293554306,0.32221782207489,0.0456090308725834,0.0673316121101379,0.00396145740523934,0.652777850627899,0.498280167579651,0.0244021341204643,0.574151635169983,0.929324805736542,0.294838756322861,0.253985732793808,0.839060544967651,0.195419296622276,0.50508314371109,0.784938037395477,0.664130985736847,0.471898913383484,0.839060544967651,0.294838756322861,0.195419296622276,0.253985732793808
"84","subCALEARN_84","Looks like they try to say that these are not the person's fault? ","Seems like it plays with having a healthy amount of self esteem and confidence?","Nothing is my fault","I am good enough","Same as before","Same as before",0.0331287160515785,0.351164251565933,0.935264348983765,0.483273029327393,0.0763294920325279,0.234818041324615,0.227677434682846,0.331110209226608,0.087199330329895,0.832831859588623,0.718495845794678,0.333711177110672,0.98322606086731,0.222428247332573,0.407551467418671,0.00347760855220258,0.00298226438462734,0.0212649274617434,0.277561068534851,0.991920053958893,0.991920053958893,0.277561068534851,0.0212649274617434,0.00298226438462734
"85","subCALEARN_85","Natural things such as animals","Natural things such as fruit","Man made things","Natural things","man made objects","natural objects",0.00016301883442793,6.25777101959102e-05,0.015402608551085,0.108766928315163,0.0828993394970894,0.00117084395606071,5.12130900460761e-05,0.0101634915918112,0.3922298848629,0.130159974098206,0.536461532115936,0.153236702084541,0.00307775428518653,0.0136484485119581,0.723634779453278,0.000115733077109326,0.410627633333206,0.311087518930435,0.242322951555252,0.463984727859497,0.438267290592194,0.00184414477553219,0.000263601657934487,0.0421911403536797
"86","subCALEARN_86","meats or animals like goat birds or a tiger","vegetables or any flowers","human made like hooks or wires","natural that not human made like flowers or vegetables","human-made like trucks or tv","natural things that not made from human like fruits and peanuts",0.000314527744194493,0.000325761880958453,0.778624653816223,0.0428433977067471,0.125009179115295,0.00486895674839616,0.000299637031275779,0.0645291209220886,0.46041664481163,0.915687739849091,0.177399650216103,0.473883211612701,0.000527415715623647,0.0615463256835938,0.403215259313583,0.00238535786047578,0.131165727972984,0.405054092407227,0.00849545933306217,0.0553332827985287,0.354706883430481,0.00149561825674027,0.00776701141148806,0.132583275437355
"87","subCALEARN_87","I think this basket contained larger objects, specifically animals.","I think this basket contained edible items like fruit & vegetables.","Man-made items.","Natural items.","Man-made items which were very big","Natural items which were smaller",0.000519006978720427,0.000176005836692639,0.984290242195129,0.00922639761120081,0.1704161465168,0.0505849421024323,0.0422325171530247,0.48679706454277,0.461770325899124,0.0285156089812517,0.473587542772293,0.00466399919241667,0.0104077951982617,0.0339815616607666,0.381872057914734,0.000201888949959539,0.528830707073212,0.011405517347157,0.00153097440488636,0.127412691712379,0.214457377791405,0.00865381862968206,0.000192654581042007,0.175921499729156
"88","subCALEARN_88","animals","foods","man made","natural","human made","natural",0.000154618814121932,0.00028302485588938,0.252195060253143,0.123333349823952,0.186456337571144,0.0245492737740278,0.000762437761295587,0.103245101869106,0.498280167579651,0.0244021341204643,0.574151635169983,0.929324805736542,0.294838756322861,0.253985732793808,0.839060544967651,0.195419296622276,0.50508314371109,0.784938037395477,0.664130985736847,0.471898913383484,0.839060544967651,0.294838756322861,0.195419296622276,0.253985732793808
"89","subCALEARN_89","That it was usually not something I had done but something affecting the other person ","they are of a person who is self confident and thinks well of themselves","the thought of the person is to always point blame at someone else or think that tis never their fault","the person seems to think they are good at everything and if something goes wrong it wasnt their fault ","arrogance","self cantered arrogance",0.00510238483548164,0.979226469993591,0.801566362380981,0.314229547977448,0.374269545078278,0.258208513259888,0.0116817820817232,0.105297826230526,0.157542005181313,0.906769573688507,0.521816909313202,0.00572606874629855,0.0682036206126213,0.0752707272768021,0.328226894140244,0.0316724926233292,0.188129737973213,0.453219175338745,0.291527390480042,0.710521161556244,0.696485102176666,0.987679779529572,0.00228576129302382,0.199696063995361
"90","subCALEARN_90","doubting yourself","using the word I,being more positive","negative answers","positive answers and thoughts","negative thoughts","positive thoughts",0.802921116352081,0.00864483881741762,0.370358407497406,0.618385255336761,0.0325282737612724,0.922514975070953,0.00150421797297895,0.337863683700562,0.689159631729126,0.371171802282333,0.818955540657043,0.271586030721664,0.230010613799095,0.157175078988075,0.498563349246979,0.189116626977921,0.212479576468468,0.114658512175083,0.369900614023209,0.54411119222641,0.471609473228455,0.242638275027275,0.130862802267075,0.0869980379939079
"91","subCALEARN_91","I didn't give the event the time or attention it needed","I am confident in myself and my abilities","These things happen to everyone sometimes","I'm a likeable person","Other people are responsible","I am responsible for the positive stuff. I'm very self-confident",0.890881240367889,0.0925854593515396,0.385566234588623,0.0603671446442604,0.240200251340866,0.956229269504547,0.00202159467153251,0.254917353391647,0.0251251235604286,0.926244139671326,0.996446132659912,0.0293493364006281,0.974333465099335,0.149676859378815,0.479123085737228,0.0354858711361885,0.77855396270752,0.999274551868439,0.000162953321705572,0.865737020969391,0.212466418743134,0.97719544172287,0.00181104952935129,0.465179711580276
"92","subCALEARN_92","Large animals ","food or natural objects such as plants ","small manmade objects","small natural objects ","large man made objects","small natural objects",0.000623124709818512,0.000102157311630435,0.366166055202484,0.172080025076866,0.15631890296936,0.000647875596769154,7.78167668613605e-05,0.0702931806445122,0.250226646661758,0.00143069564364851,0.257886946201324,0.00422360794618726,0.00187298515811563,0.0655640885233879,0.0435997508466244,0.000109218664874788,0.185492247343063,0.0676819905638695,0.0317481532692909,0.327883720397949,0.0505354292690754,0.00189239252358675,0.000107476524135564,0.0820247083902359
"93","subCALEARN_93","They are single events usually caused by external circumstances","They are events reflective of positive aspects of my personality","They are usually due to other people or external events","They are usually due to a positive aspect of my personality","They are attributed to external factors","They are attributed to a positive aspect of my personality",0.00419124076142907,0.0322259850800037,0.99135822057724,0.0111324330791831,0.00964203011244535,0.503710269927979,0.00324768899008632,0.996304452419281,0.772730946540833,0.895102858543396,0.103059835731983,0.000679808901622891,0.743371903896332,0.443790942430496,0.0088092377409339,0.00379903288558125,0.323592483997345,0.982659637928009,0.000171502528246492,0.359450310468674,0.00596955930814147,0.772340178489685,0.00256765051744878,0.285626232624054
"94","subCALEARN_94","These reasons tend to be forgiving, they take account for external factors influencing events and do not put all the blame on the individual","These  reasons were very affirming, they suggests that positive events happen because of the actions of the individual","Predominantly affected/causes be external factors","Good things happen because of the qualities of the individual","Caused by external factors","Caused by the individual",0.0740987509489059,0.349544793367386,0.298329293727875,0.67054158449173,0.0973738059401512,0.14501841366291,0.000730511033907533,0.219518527388573,0.0366416461765766,0.835820853710175,0.332764238119125,0.000436350906966254,0.274679690599442,0.174440801143646,0.00577319413423538,0.0019300589337945,0.0671942234039307,0.971530139446259,0.000291599193587899,0.126773223280907,0.00109161471482366,0.837001860141754,0.00187017349526286,0.868506848812103
"95","subCALEARN_95","family members always asking for expensive things that we can't fit into our budget.","friends planning on going on holiday soon.","family members asking for expensive item I can't buy it","going on holiday soon with friends.","family members asking for items I can't pay for them.","going on holiday with friends.",0.0054920488037169,0.993250668048859,0.702805042266846,0.426763892173767,0.106250211596489,0.00151552038732916,0.991350471973419,0.728237867355347,0.952862858772278,0.993123292922974,0.292419105768204,0.00541271781548858,0.00573344947770238,0.600226581096649,0.0509991161525249,0.978762686252594,0.9524205327034,0.993346214294434,0.0167001243680716,0.333572268486023,0.166765943169594,0.00474502285942435,0.984520673751831,0.789571106433868
"96","subCALEARN_96","it was a one off because of something and not cos i am a bad person","because you are a nice person and people want you involved etc","someone else or something got in your way","because you area good person, do things well etc","positive spin","love themselves",0.387515813112259,0.046387605369091,0.990107953548431,0.000582893146201968,0.253729611635208,0.0779498293995857,0.781806468963623,0.303216367959976,0.802244484424591,0.985962212085724,0.431457847356796,0.0016549980500713,0.0817635953426361,0.109876744449139,0.369447529315948,0.0350580997765064,0.440328776836395,0.318407446146011,0.146552890539169,0.722479462623596,0.805112242698669,0.855721950531006,0.0059753586538136,0.205374360084534
"97","subCALEARN_97","Optimistic","Directly caused by myself","Circumstancial and not my fault","Totally caused by me","Circumstances","Myself",0.27620142698288,0.300345361232758,0.127728044986725,0.791669309139252,0.00087566627189517,0.995701014995575,0.000342419749358669,0.664650976657867,0.641203105449677,0.940665364265442,0.230088382959366,0.0372216552495956,0.996066749095917,0.601568996906281,0.0105564491823316,0.000666085630655289,0.990353226661682,0.156483963131905,0.0472216345369816,0.408260881900787,0.00389830302447081,0.997955918312073,0.000170851388247684,0.654600322246552
"98","subCALEARN_98","Because I am not good at organising things or people have a negative view of me because of something I did","People think that I am generally a good person.","Just because life gets in the way of things sometime.","Because I am popular and good at things.","Sometimes there is just not enough time and we cant be good at everything.","Because I am an intelligent and popular guy who gets on with people.",0.64359176158905,0.387049376964569,0.40454888343811,0.104845240712166,0.956310153007507,0.939294517040253,0.854051530361176,0.0743621587753296,0.130954131484032,0.255996912717819,0.710518479347229,0.0580704919993877,0.878125011920929,0.246858671307564,0.158582225441933,0.0153125030919909,0.777902841567993,0.0802100524306297,0.223201096057892,0.476409733295441,0.294655919075012,0.977635860443115,0.643100142478943,0.215331524610519
"99","subCALEARN_99","When you haven't been able to get something done.","When you have had positive feedback and been able to do something on time","When you haven't been able to get something done","When you have positive feedback or someone has done something nice for you","When you haven't been included by other people","When you are able to get something done, complete a task",0.126271918416023,0.0668991133570671,0.862961888313293,0.0979743152856827,0.224280774593353,0.433437585830688,0.0925743505358696,0.730298161506653,0.863564014434814,0.0430847369134426,0.0602637641131878,0.112842552363873,0.0792304500937462,0.928590774536133,0.0557755418121815,0.863342761993408,0.953277766704559,0.8477543592453,0.108645401895046,0.135367542505264,0.279502600431442,0.268156796693802,0.078319139778614,0.313956946134567
"100","subCALEARN_100","something out of my control, there was nothing I did wrong or could have done better","I am amazing, everything that goes my way is purely because I have earned it by being the best.","I personally could have done better, I didn't try my hardest","I did well and deserved it","out of my hands, bad things happen because they happen to everyone","I am the only reason for all positive things happening to me.",0.078338086605072,0.207144662737846,0.579930543899536,0.25666618347168,0.211742416024208,0.97400164604187,0.00354347820393741,0.18453648686409,0.38205286860466,0.00263815256766975,0.230623200535774,0.986849904060364,0.933741331100464,0.5492804646492,0.204406961798668,0.00178342766594142,0.0235054399818182,0.966873943805695,0.0386671349406242,0.979818642139435,0.0338265672326088,0.995866119861603,0.000467385514639318,0.262852102518082
"101","subCALEARN_101","People didn't want to attribute negative events to themselves","People often wanted to own positive events","People don't want to attribute negative events to their individual attributes","People think good things happen to them because of who they are","People attribute negative events to reasons out of their own control","People like to think positive events are due to their uniqueness",0.0688392892479897,0.222767949104309,0.551474809646606,0.237868577241898,0.681849420070648,0.0417610518634319,0.372686058282852,0.521603107452393,0.598517060279846,0.1322350949049,0.514694392681122,0.123377785086632,0.0670852139592171,0.0858117043972015,0.16125813126564,0.051408376544714,0.424039036035538,0.259750366210938,0.0205925274640322,0.530755281448364,0.00575480749830604,0.0270512457937002,0.0454492457211018,0.978837549686432
"102","subCALEARN_102","The negative thing happened for a specific reason for that specific event, it does not define your entire character. ","You cannot let one negative thing define yourself","If there is a negative event there is a reason for it, it has nothing to do with you. People have their reasons and their own problems too","If something positive happens it's more to do with your own worth, not because its the right thing to do. You have value","There is not always malice behind those negative events, there is always a plausible reason","Positive events happened because of who you are as a person, not because people had an ulterior motive",0.16368468105793,0.118841268122196,0.983346104621887,0.0146597139537334,0.318043649196625,0.21980594098568,0.0329581499099731,0.167248666286469,0.661409556865692,0.965682685375214,0.711999773979187,0.0361569337546825,0.533051490783691,0.471542567014694,0.866242706775665,0.00858664326369762,0.856372654438019,0.268628150224686,0.067277655005455,0.594351053237915,0.541323363780975,0.238527581095695,0.0853932872414589,0.162765488028526
"103","subCALEARN_103","They tended to be situational (""on this occasion I did not"")","These were because the individual is always like that in general.","Negative events were characterised as things that happen to everyone.","These were because the individual is particularly brilliant themselves (rather than everyone being brilliant)","These were just related to the situation, and were described a things that happen to everyone.","These were because of individual reasons with the person always being like that.",0.573899865150452,0.442879974842072,0.998352587223053,0.00124242040328681,0.988790988922119,0.16000497341156,0.128161609172821,0.0038175848312676,0.00947530195116997,0.927265584468842,0.995770394802094,0.0275301113724709,0.893284499645233,0.99129194021225,0.00170909345615655,0.00193624093662947,0.0321398824453354,0.652617037296295,0.026456955820322,0.11976333707571,0.000346000742865726,0.0587910450994968,0.112325347959995,0.997496902942657
