"34","subCALEARN_34","They are just mistakes I made and are not commonplace.","They occur because of my fundamental nature. ","They are mistakes on my part or because of circumstances beyond my control. ","They happen because I'm a good person surrounded by good people. ","I sometimes make little mistakes, and so do other people. ","They happen because I'm a good person, and so are my friends, family and coworkers. ",0.691759049892426,0.00886441022157669,0.917522370815277,0.00613380875438452,0.0909966230392456,0.788625121116638,0.000334751704940572,0.741847395896912,0.934689402580261,0.00267890957184136,0.157205924391747,0.136041939258575,0.0285452790558338,0.696269035339355,0.452814429998398,0.909616529941559,0.0254518091678619,0.959393680095673,0.326356768608093,0.959747672080994,0.614296555519104,0.200167685747147,0.832582354545593,0.852063715457916
"35","subCALEARN_35","External factors or another reason.","Personal effort or natural ability.","Kind to self, it happens, shirking personal responsibility","Self confidence","Other external reasons","Personal reasons, skilled, talented",0.00261918012984097,0.770445346832275,0.288461357355118,0.299972802400589,0.0548487305641174,0.379013776779175,0.00096809328533709,0.270541965961456,0.222640916705132,0.115716926753521,0.688371241092682,0.930710434913635,0.960080683231354,0.191769301891327,0.172463640570641,0.00227878824807703,0.654038310050964,0.991180777549744,0.00113870168570429,0.200654476881027,0.00226493715308607,0.775196671485901,0.00480753043666482,0.983630061149597
"36","subCALEARN_36","Things to eat","Animals","Man-made","Natural","Man-made","Natural",0.0540089048445225,0.0100803785026073,0.262308269739151,0.223616555333138,0.0688452050089836,0.000235934101510793,0.00021235691383481,0.370512843132019,0.227472424507141,0.0142132891342044,0.792684316635132,0.042303416877985,0.207742840051651,0.0359081104397774,0.926508188247681,0.0107628265395761,0.227472424507141,0.0142132891342044,0.042303416877985,0.792684316635132,0.926508188247681,0.207742840051651,0.0107628265395761,0.0359081104397774
"37","subCALEARN_37","Animals","Plants","Manmade","Natural","Manmade","Natural",0.000235934101510793,0.00021235691383481,0.370512843132019,0.0688452050089836,0.0527870655059814,0.000344886066159233,7.88186080171727e-05,0.168832659721375,0.20972315967083,0.0262453742325306,0.789882063865662,0.0270487628877163,0.207742840051651,0.0359081104397774,0.926508188247681,0.0107628265395761,0.20972315967083,0.0262453742325306,0.0270487628877163,0.789882063865662,0.926508188247681,0.207742840051651,0.0107628265395761,0.0359081104397774
"38","subCALEARN_38","Big things mostly animals","Small things that can be bought in a shop","Inanimate","Natural","Big","Small",0.000117259165563155,0.000283230881905183,0.293172895908356,0.0274212807416916,0.182312563061714,0.0162343308329582,0.00185274763498455,0.120951108634472,0.00697413366287947,0.000105864550278056,0.640741884708405,0.00032176382956095,0.207742840051651,0.0359081104397774,0.926508188247681,0.0107628265395761,0.411213517189026,0.591213703155518,0.368863940238953,0.786731839179993,0.0867343619465828,0.470964342355728,0.609569787979126,0.811461389064789
"39","subCALEARN_39","Thinking the most positive way about negative events.","Thinking very positively about self during positive events.","Thinking positively even when negative events are happening.","It is due to myself that the positive event has happened.","They are due to circumstance, not ""me"".","They are due to me and the person I am.",0.218892276287079,0.202068611979485,0.748067200183868,0.36414498090744,0.19653058052063,0.747921764850616,0.00109757867176086,0.809109628200531,0.675856471061707,0.366598039865494,0.673135757446289,0.289824485778809,0.999277770519257,0.597638010978699,0.0188378188759089,0.000217085049371235,0.998568654060364,0.995522916316986,0.00323682464659214,0.334845811128616,0.00465407175943255,0.991676509380341,0.000782557588536292,0.557714402675629
"40","subCALEARN_40","I think it was a more positive answer.","It was being able to accept a compliment.","They are almost a positive self talk response.","I like them they feel good.","They were a sort of positive self talk.","It was like self talk.",0.131916075944901,0.315428376197815,0.533712863922119,0.521334946155548,0.465401530265808,0.334275335073471,0.214669227600098,0.602838039398193,0.378889977931976,0.00129314383957535,0.202233344316483,0.433491319417953,0.164609625935555,0.262444466352463,0.313986152410507,0.680716335773468,0.174359172582626,0.00368770863860846,0.349313586950302,0.103611908853054,0.0174424313008785,0.676196873188019,0.000191607978194952,0.093263104557991
"41","subCALEARN_41","animals","things from the garden","man made","natural","large man made objects","small natural objects",0.000154618814121932,0.00028302485588938,0.252195060253143,0.123333349823952,0.00580898066982627,0.000881089188624173,0.000609304523095489,0.139274463057518,0.498280167579651,0.0244021341204643,0.574151635169983,0.929324805736542,0.294838756322861,0.253985732793808,0.839060544967651,0.195419296622276,0.185492247343063,0.0676819905638695,0.0317481532692909,0.327883720397949,0.0505354292690754,0.00189239252358675,0.000107476524135564,0.0820247083902359
"42","subCALEARN_42","larger than a shoe box ","smaller than a shoe box ","man made items ","natural items ","larger than a shoe box. man made items ","natural items, smaller than a shoe box ",0.0453416332602501,0.0707840099930763,0.10351274907589,0.153814628720284,0.14369010925293,0.132596671581268,0.0754481852054596,0.193443402647972,0.302820354700089,0.834725499153137,0.0998324528336525,0.381868422031403,0.0226136445999146,0.0493562705814838,0.400672107934952,0.000480496208183467,0.185711517930031,0.0522176399827003,0.0197582114487886,0.274725139141083,0.247663483023643,0.0300876311957836,0.00117511209100485,0.159450560808182
"43","subCALEARN_43","take accountability for the negative events rather than put the blame on other reasons","the positive events are due to yourself, praise yourself and take a positive view of yourself","the correct reason for negative events is not always yourself","the correct reasons for positive events is yourself","misunderstandings can be a reason for negative events - it is not always your fault","you make the positives happen for yourself, nobody else",0.4658522605896,0.468215823173523,0.877437174320221,0.574767649173737,0.353633910417557,0.856879413127899,0.000112965572043322,0.152421712875366,0.760358095169067,0.712404906749725,0.522748947143555,0.0114878714084625,0.995249629020691,0.29249632358551,0.18483854830265,0.000176787027157843,0.260154843330383,0.338507354259491,0.144476816058159,0.544777393341064,0.602392792701721,0.760725319385529,0.00471879029646516,0.534506916999817
"44","subCALEARN_44","Animals, I thought mammals?","Edible items, i.e. fruit and vegetables","Small natural objects","Small man-made objects","Large man-made objects","Small natural objects",0.00111284793820232,8.21587964310311e-05,0.0891623869538307,0.0185519400984049,0.211880892515182,0.0274775177240372,0.00178172043524683,0.0883112028241158,0.0997383892536163,0.000112208799691871,0.082099623978138,0.00139028311241418,0.00447422033175826,0.220713406801224,0.223065048456192,0.00265548564493656,0.157361581921577,0.00112390040885657,0.000811622478067875,0.337999522686005,0.082099623978138,0.00139028311241418,0.000112208799691871,0.0997383892536163
"45","subCALEARN_45","When something negative occurred, the correct response to view it as an isolated incident, learn from it and not use it to tear down your entire character. ","When the event was positive, it was good to use ""I am"" statements to help instill within yourself that this is the type of person I am. ","Negative events were seen as a one off and something to learn from, and not as an implication as to you are as a person.","Positive events help build your self esteem and self worth in order to see yourself in a positive manner.","The negative events were framed to see the events or other people in a positive light, without tearing down yourself or others in the process. It helps you to maintain a positive outlook on live.","The responses to the positive events helped to see yourself in a positive light, increasing your own view of your self worth and self esteem. ",0.228513434529305,0.088434025645256,0.777543962001801,0.0102915707975626,0.0428598709404469,0.872130632400513,0.0087021142244339,0.146300315856934,0.412846058607101,0.0718063935637474,0.00402871472761035,0.0917864441871643,0.610570728778839,0.15956911444664,0.473493307828903,0.0754439607262611,0.888358950614929,0.936279118061066,0.129947066307068,0.580612003803253,0.325304120779037,0.624588429927826,0.0432465523481369,0.401245951652527
"46","subCALEARN_46","animals, particularly birds it seems","fruit/veg/foodstuffs","inorganic","organic","manmade","natural",7.4943141953554e-05,7.23694611224346e-05,0.234153658151627,0.105282284319401,0.0440184101462364,0.0256460197269917,0.0005454255733639,0.294227987527847,0.0822432413697243,0.0481241457164288,0.735067784786224,0.0143956784158945,0.0862704440951347,0.446855008602142,0.830132663249969,0.351936995983124,0.214885860681534,0.0166949089616537,0.0286794230341911,0.816728949546814,0.839060544967651,0.294838756322861,0.195419296622276,0.253985732793808
"47","subCALEARN_47","Sometimes i just didn't put enough effort in","making the effort helps positive things happen","sometimes things just don't go to plan.","working hard makes positive things happen","sometimes hings just don't work out - its doesn't  mean its automatcally my fault","hard work pays off - theres nothing wrong with being positive about how things turn out",0.89302384853363,0.0496235378086567,0.632579565048218,0.490810811519623,0.700204610824585,0.460108935832977,0.502954363822937,0.278739124536514,0.530530571937561,0.177495375275612,0.452055215835571,0.132231697440147,0.337682008743286,0.263482570648193,0.583062469959259,0.255196422338486,0.672503352165222,0.25013056397438,0.189553380012512,0.635754227638245,0.42589670419693,0.202041178941727,0.160536110401154,0.0899733603000641
"48","subCALEARN_48","animals/ mammals","food","natural","human made","human","natural",0.00115328712854534,0.000131588385556825,0.296693712472916,0.0910760760307312,0.262918680906296,0.0951568558812141,0.00183982704766095,0.229416087269783,0.253985732793808,0.195419296622276,0.839060544967651,0.294838756322861,0.664130985736847,0.50508314371109,0.471898913383484,0.784938037395477,0.506720185279846,0.946820378303528,0.683380961418152,0.375444501638412,0.839060544967651,0.294838756322861,0.195419296622276,0.253985732793808
"49","subCALEARN_49","food","animals","manmade","natural","large manmade","small natural",0.0951568558812141,0.00183982704766095,0.229416087269783,0.262918680906296,0.123333349823952,0.000154618814121932,0.00028302485588938,0.252195060253143,0.214885860681534,0.0166949089616537,0.816728949546814,0.0286794230341911,0.294838756322861,0.253985732793808,0.839060544967651,0.195419296622276,0.0881460532546043,0.0192178171128035,0.0169316790997982,0.664260923862457,0.150149330496788,0.317235857248306,0.0112927472218871,0.140350580215454
"50","subCALEARN_50","Not a reflection of your character just general mistakes that happen sometimes","Generally liked by others and able to get things done","Everyone gets things wrong sometimes","People like to be around you or do nice things for you","Was unable to do the thing on this particular occasion for whatever reason","Likeable",0.0661725327372551,0.15657751262188,0.00252882204949856,0.994396030902863,0.988147139549255,0.25149068236351,0.857704281806946,0.0531315729022026,0.143428593873978,0.962217271327972,0.980828046798706,0.150036096572876,0.143240123987198,0.316684693098068,0.504568338394165,0.965853154659271,0.975070416927338,0.178879141807556,0.453034728765488,0.0438803769648075,0.806201636791229,0.301807940006256,0.682790279388428,0.249249503016472
"51","subCALEARN_51","its due to a small precise reason","its because of their whole encompassing character","its due to a specific reason","its because all round there are the best person ever","its tends to blame on someone or something else","its due to their character",0.073635958135128,0.0416991896927357,0.973009824752808,0.00120015128049999,0.85625422000885,0.00206686044111848,0.104081980884075,0.00164926366414875,0.981711030006409,0.11016571521759,0.000738043338060379,0.128405258059502,0.0108727505430579,0.00445746164768934,0.986130237579346,0.932740330696106,0.650650799274445,0.965129554271698,0.00627662241458893,0.306345224380493,0.00462393602356315,0.00160268857143819,0.168608576059341,0.119396731257439
"52","subCALEARN_52","They are the more negative outlook for you as a person.","They are the more positive outlook for you as a person.","The events are a negative take on you as a person.","The events are a positive take on you as a person.","The negative events are by you looking down on yourself.","The positive events are by you being positive about yourself.",0.053492359817028,0.595593810081482,0.471104800701141,0.261773854494095,0.269410014152527,0.109095767140388,0.313579052686691,0.192674368619919,0.966492831707001,0.151989072561264,0.540950059890747,0.120020769536495,0.179683998227119,0.8593390583992,0.579101026058197,0.0613039322197437,0.968872725963593,0.000487562123453245,0.0347952768206596,0.261364609003067,0.271878212690353,0.587454557418823,0.000218434943235479,0.604588687419891
"53","subCALEARN_53","Large items, too big for a shoebox","Food items","Man made items","Natural items","Large, man made items","Small, natural items",0.0108736557886004,0.00619236379861832,0.665779113769531,0.151877447962761,0.0209175404161215,0.00709909340366721,0.000249303149757907,0.0701496973633766,0.488786667585373,0.86100560426712,0.332557946443558,0.0625283345580101,0.00669047236442566,0.0122051732614636,0.32741442322731,0.000112767585960682,0.273256570100784,0.250630348920822,0.013215871527791,0.278422504663467,0.463472217321396,0.0103590385988355,0.00017727907106746,0.104241758584976
"54","subCALEARN_54","The circumstances were bad on this occasion","People respect and like me and I try my best","Sometimes things just go wrong and it happens to everyone","If you are a good person and try your best then things will go well","Everything goes wrong sometimes","People like to be around you",0.0594656877219677,0.116939090192318,0.997057259082794,0.0563070178031921,0.511852025985718,0.938821852207184,0.718674898147583,0.40302312374115,0.011238930746913,0.91167277097702,0.986291587352753,0.0227064099162817,0.298963993787766,0.147752687335014,0.573216438293457,0.278024464845657,0.198083862662315,0.295635640621185,0.150180473923683,0.971655547618866,0.560400784015656,0.202881336212158,0.970517098903656,0.214576169848442
"55","subCALEARN_55","I did something in this specific circumstance to cause this","My overall character is the reason for this happening","It is caused by something out of my control/external explanation","It's the result of who I am as a person","It is the result of the specific circumstance out of my control","It is the result of my general capabilities",0.992367267608643,0.00182438013143837,0.995381414890289,0.000260911794612184,0.285918176174164,0.967797696590424,0.000120694865472615,0.00580402044579387,0.519425928592682,0.477113515138626,0.103643536567688,0.000603613036219031,0.969365298748016,0.0183932296931744,0.0660936906933784,0.000579880841542035,0.99760514497757,0.335687726736069,0.00299996114335954,0.000366929540177807,0.993944108486176,0.791016519069672,0.000254833663348109,0.00080193649046123
"56","subCALEARN_56","miscommunications","a sense of your own strengths ","They tended to be circumstantial ","They were down to personal positive traits","down to miscommunication ","they were affirming to your strengths ",0.069453626871109,0.509876430034637,0.350219368934631,0.750758767127991,0.00891155283898115,0.426889896392822,0.000205488700885326,0.144010633230209,0.995454907417297,0.786683797836304,0.00670302705839276,0.00612758519127965,0.251383513212204,0.300828367471695,0.00127913104370236,0.0122824003919959,0.154747724533081,0.327445179224014,0.126731008291245,0.630753815174103,0.481321007013321,0.0522171854972839,0.938675105571747,0.455362886190414
"57","subCALEARN_57","Not putting in enough time or effort. ","Getting things done straight away by putting in the effort.","Things outside my control.","Positive events happened because of me and things I'm good at or have done well.","Negative events were caused by others.","Positive events were down to me being good at things.",0.489794015884399,0.303613215684891,0.479144334793091,0.560752093791962,0.568969249725342,0.316390365362167,0.202712997794151,0.168847918510437,0.972253203392029,0.989146173000336,0.413594245910645,0.00213630357757211,0.991223096847534,0.662942826747894,0.310941964387894,0.000266212999122217,0.892046868801117,0.995930969715118,0.00115132227074355,0.65004825592041,0.14509791135788,0.98159396648407,0.000697307055816054,0.730755984783173
"58","subCALEARN_58","I made individual errors","I have a good skill set","Everyone makes mistakes sometimes","I am likeable and good at things","People are sometimes pre-occupied","I have a number of positive attributes",0.927365899085999,0.00925875827670097,0.994975447654724,0.00286951451562345,0.200805798172951,0.930394768714905,0.00414991984143853,0.137206673622131,0.18786908686161,0.964751422405243,0.989053428173065,0.34513846039772,0.957558333873749,0.198141947388649,0.323500782251358,0.037516575306654,0.875637471675873,0.895138442516327,0.0908186659216881,0.863681495189667,0.443601012229919,0.955163300037384,0.00419431179761887,0.126291826367378
"59","subCALEARN_59","this person doesn't put all of the blame onto themselves when something negative happens, they are able to consider other aspects ","This person acknowledges their own positive traits when something positive happens and doesn't put it all down to chance or luck","the correct reasons for negative events were more generalised statements about how everyone can forget things/make mistakes sometimes ","the reasons for positive events were more to do with the person's personality traits and strengths ","The reason for negative events included rational alternative explanations ","The reason for positive events included the person acknowledging what they're good at",0.231937453150749,0.0788633748888969,0.449624419212341,0.427637338638306,0.387421160936356,0.622528254985809,0.00142558314837515,0.70071542263031,0.00196079025045037,0.516749858856201,0.978463053703308,0.0262486115098,0.12115353345871,0.143775567412376,0.0582342892885208,0.0974444672465324,0.749212503433228,0.0466204807162285,0.0189993642270565,0.382249057292938,0.308920472860336,0.400715410709381,0.0224223639816046,0.468528807163239
"60","subCALEARN_60","Seems to be making excuses for the negative events and never blaming themselves","They seem very cocky","Seem to blame other people for it.","they believe they are the reason for all the positive things","negative events were specific excuses.","positive events seemed to be more broad statements eg ""great thinker"" ",0.283702909946442,0.651437640190125,0.792089104652405,0.847590804100037,0.592580258846283,0.00107538641896099,0.916211843490601,0.353156864643097,0.64753258228302,0.994894444942474,0.619498312473297,0.000848249590490013,0.0145661076530814,0.246578305959702,0.269903510808945,0.0955223068594933,0.993690848350525,0.157909080386162,0.0386276319622993,0.00377516495063901,0.952459096908569,0.0348474122583866,0.211542516946793,0.00289157847873867
"61","subCALEARN_61","It was nothing to with me personally or a reflection of me","I am a good person who people like and care about","Things in life don't always go people's way and this is something that happens to everyone and shouldn't be taken personally","I am a person who has a number of good qualities and who people like and care about","The reasons were more about other people than myself personally or anything that I had done","I am a good person who people like to know and spend time with",0.00647922046482563,0.978375256061554,0.405805557966232,0.989846348762512,0.356181383132935,0.968002736568451,0.380300790071487,0.127474710345268,0.0250578224658966,0.906611561775208,0.996283233165741,0.03610710054636,0.990753471851349,0.0896412879228592,0.357596188783646,0.00958719756454229,0.933634400367737,0.99685662984848,0.0101692322641611,0.718361020088196,0.409674465656281,0.95019793510437,0.162175878882408,0.154088363051414
"62","subCALEARN_62","the reason is based of the specific circumstance, not in general. ","correct reasons are based off of one's personality, and can be adapted to each positive event","not blaming yourself but other circumstances relating to the event. ","promoting yourself as a good person. not being the same as everyone else. ","blame can be passed to the circumstance. ","general good personality of the individual.  ",0.141109868884087,0.10181187838316,0.993094623088837,0.0070477407425642,0.0154057173058391,0.272519528865814,0.00613034097477794,0.238479182124138,0.989459693431854,0.825086653232574,0.717711567878723,0.0960427969694138,0.190838679671288,0.275015711784363,0.438818782567978,0.422401040792465,0.573959827423096,0.378224730491638,0.0281579233705997,0.226774200797081,0.961886763572693,0.272398442029953,0.00326188374310732,0.00078672869130969
"63","subCALEARN_63","not being prepared properly or not taking the task seriously","being in control of the situation","unfocused","focused on achieving things","miscommunication","self confidence and self belief",0.374562948942184,0.348929166793823,0.66331022977829,0.497920274734497,0.248912617564201,0.510686278343201,0.0782782211899757,0.556804716587067,0.0274112783372402,0.457037359476089,0.705924153327942,0.471588015556335,0.4783855676651,0.93540632724762,0.0627981498837471,0.286347627639771,0.226502925157547,0.574869751930237,0.167347177863121,0.775437712669373,0.446760982275009,0.836528956890106,0.0174234099686146,0.14482145011425
"64","subCALEARN_64","small natural","larger","handmade","natural","human made big","natural and small",0.317235857248306,0.0112927472218871,0.140350580215454,0.150149330496788,0.777908504009247,0.225676596164703,0.58574104309082,0.410620510578156,0.676478862762451,0.0530259311199188,0.015793215483427,0.552842319011688,0.294838756322861,0.253985732793808,0.839060544967651,0.195419296622276,0.318501353263855,0.147194996476173,0.436560720205307,0.509408175945282,0.417540043592453,0.141173899173737,0.0706132352352142,0.883498311042786
"65","subCALEARN_65","Isolated events that are not common - usually through momentary lapse or distraction","Nice and highly competent person","Blame on other people or outside events","All down to the individual","Not my fault","All down to me",0.0340592674911022,0.0196093674749136,0.99765932559967,0.00084188993787393,0.571660399436951,0.336417585611343,0.186615809798241,0.219549596309662,0.171617209911346,0.983737587928772,0.478706210851669,0.000518532644491643,0.76395720243454,0.964781761169434,0.00219472288154066,0.00327568803913891,0.504436075687408,0.979413986206055,0.0309712514281273,0.784516096115112,0.00641931034624577,0.997742593288422,0.00043708662269637,0.666201233863831
"66","subCALEARN_66","The reasons for negative events were based on external factors some that may have been out of my control","The correct reasons for positive events are to do with having a good character and positive personal attributes.","Usually external or circumstantial ","Based on continuous positive attributes of myself as a person","Negative events seem to be to do with specific circumstances or things out of the person's control","Positive events seemed to be linked to the person's character",0.00165746686980128,0.829264521598816,0.807349562644958,0.349855720996857,0.300671964883804,0.208917185664177,0.0698401257395744,0.181901231408119,0.479475349187851,0.513042747974396,0.0184278134256601,0.000911443494260311,0.942318379878998,0.000961332931183279,0.0233471430838108,0.000648989342153072,0.997617244720459,0.0862051397562027,0.114582724869251,0.00483156368136406,0.157650589942932,0.257524311542511,0.115452408790588,0.370795279741287
"67","subCALEARN_67","seemed more directed than general","personal","negative statements","self praise","not direct at yourself","self indulgence",0.0291581209748983,0.182949036359787,0.893487453460693,0.022256376221776,0.00566584896296263,0.960820734500885,0.615615606307983,0.992018818855286,0.629834353923798,0.287649065256119,0.71381139755249,0.170874178409576,0.941140532493591,0.185100257396698,0.174089476466179,0.00100690161343664,0.516517043113708,0.742419242858887,0.0132880490273237,0.927576422691345,0.591302931308746,0.936020255088806,0.0078497501090169,0.275939792394638
"68","subCALEARN_68","If you didn't try hard on the article then you should take accountability for it","You were in control of the outcome based on your level of effort to the article","that someone isn't capable of fixing the house ","that someone has put the effort in to atleast try and has accomplished something","They burdened me with something they could do themselves","I am good at communicating so they wanted to utlize my skills",0.0543142706155777,0.476552516222,0.322466045618057,0.0799063742160797,0.148100733757019,0.22690837085247,0.00233272765763104,0.288811713457108,0.755741536617279,0.238811492919922,0.209568947553635,0.00404750276356936,0.181291908025742,0.144609168171883,0.462365061044693,0.197802186012268,0.881290376186371,0.943903625011444,0.481593191623688,0.651009082794189,0.151016443967819,0.942860841751099,0.0402275621891022,0.227346822619438
